<?xml version="1.0" encoding="UTF-8"?>
<HttpPages
        xmlns="http://www.w3schools.com"
        xmlns:xsi="http://www.w3.org/2001/XMLSchema-instance"
        xsi:noNamespaceSchemaLocation="crawler.xsd">
    <HttpPage>
        <condition>"1=1"</condition>
        <id>login-page</id>
        <needStore>true</needStore>
        <redirect>true</redirect>
        <image>false</image>
        <request>
            <url>https://www.baidu.com/</url>
            <method>GET</method>
            <charset>utf-8</charset>
            <timeout>3000</timeout>
        </request>
        <response>
            <extractors>
                <type>JSON</type>
                <element>user</element>
                <extractors>
                    <type>JSON</type>
                    <store element="id" object-name="user" object-field="user"/>
                </extractors>
                <store/>
            </extractors>
        </response>
    </HttpPage>
    <HttpPage>
        <condition>"1=1"</condition>
        <id>login-page</id>
        <needStore>true</needStore>
        <redirect>true</redirect>
        <image>false</image>
        <request>
            <url>https://www.baidu.com/</url>
            <method>GET</method>
            <charset>utf-8</charset>
            <timeout>3000</timeout>
        </request>
        <response>
            <extractors>
                <type>HTML</type>
                <element>user</element>
                <extractors>
                    <store element="id" object-name="user" object-field="user"/>
                </extractors>
                <store/>
            </extractors>
        </response>
    </HttpPage>

</HttpPages>




